{
  "schemaVersion": 1,
  "appId": "neue-pruefung",
  "appName": "TODO",
  "shortName": "TODO",
  "subtitle": "Deine nächste Runde\nauf der Raumstation.",
  "bundleIdentifier": "org.example.neuepruefung",
  "productName": "NeuePruefung",
  "contentPackId": "neue-pruefung",
  "defaultTheme": "ocean",
  "supportEmail": "support@example.org",
  "privacyURL": "",
  "imprintURL": "",
  "supportURL": "",
  "tipProductIds": [],
  "tipLabels": [],
  "tipMessage": "Freiwillige Unterstützung.",
  "examTerminology": {
    "categorySingular": "Thema",
    "categoryPlural": "Themen",
    "categoryShort": "Thema",
    "written": "Orbit-Prüfung",
    "practical": "Praxisrunde",
    "practiceTab": "Praxis",
    "oral": "Gespräch",
    "scenarios": "Situationen"
  },
  "featureFlags": {
    "writtenExam": true,
    "flashcards": true,
    "practicePreparation": false,
    "oralExam": false,
    "scenarioTraining": false,
    "tips": false,
    "ratings": false
  },
  "legalFile": "AppConfigs/neue-pruefung/legal.json",
  "iconAssetPath": "AppConfigs/neue-pruefung/AppIcon.appiconset",
  "storeMetadataPath": "AppConfigs/neue-pruefung/store.json",
  "legacyMigration": false,
  "notificationNamespace": "orbit.learning.",
  "brandAccent": {
    "light": 1594496,
    "dark": 11007994
  }
}
